pool-100-8-18-194.nwrknj.fios.verizon.net -> ip-10-10-0-36.ec2.internal TCP D=22 S=40962 Ack=2791744836 Seq=1940563414 Len=0 Win=501 Options=<nop,nop,tstamp 388468877 568213>
pool-100-8-18-194.nwrknj.fios.verizon.net -> ip-10-10-0-36.ec2.internal TCP D=22 S=40962 Ack=2791744888 Seq=1940563414 Len=0 Win=501 Options=<nop,nop,tstamp 388468880 568216>
pool-100-8-18-194.nwrknj.fios.verizon.net -> ip-10-10-0-36.ec2.internal TCP D=22 S=40962 Ack=2791744932 Seq=1940563414 Len=0 Win=501 Options=<nop,nop,tstamp 388468880 568216>
pool-100-8-18-194.nwrknj.fios.verizon.net -> ip-10-10-0-36.ec2.internal TCP D=22 S=40962 Ack=2791744968 Seq=1940563414 Len=0 Win=501 Options=<nop,nop,tstamp 388468880 568216>
pool-100-8-18-194.nwrknj.fios.verizon.net -> ip-10-10-0-36.ec2.internal TCP D=22 S=40962 Ack=2791745028 Seq=1940563414 Len=0 Win=501 Options=<nop,nop,tstamp 388468880 568216>
pool-100-8-18-194.nwrknj.fios.verizon.net -> ip-10-10-0-36.ec2.internal TCP D=22 S=40960 Push Ack=1440309496 Seq=1196264544 Len=36 Win=501 Options=<nop,nop,tstamp 388469487 567036>
ip-10-10-0-36.ec2.internal -> pool-100-8-18-194.nwrknj.fios.verizon.net TCP D=40960 S=22 Push Ack=1196264580 Seq=1440309496 Len=36 Win=64436 Options=<nop,nop,tstamp 568833 388469487>
ip-10-10-0-36.ec2.internal -> pool-100-8-18-194.nwrknj.fios.verizon.net TCP D=40960 S=22 Push Ack=1196264580 Seq=1440309532 Len=44 Win=64436 Options=<nop,nop,tstamp 568836 388469487>
ip-10-10-0-36.ec2.internal -> pool-100-8-18-194.nwrknj.fios.verizon.net TCP D=40960 S=22 Push Ack=1196264580 Seq=1440309576 Len=52 Win=64436 Options=<nop,nop,tstamp 568836 388469487>
ip-10-10-0-36.ec2.internal -> pool-100-8-18-194.nwrknj.fios.verizon.net TCP D=40960 S=22 Push Ack=1196264580 Seq=1440309628 Len=52 Win=64436 Options=<nop,nop,tstamp 568836 388469487>
ip-10-10-0-36.ec2.internal -> pool-100-8-18-194.nwrknj.fios.verizon.net TCP D=40960 S=22 Push Ack=1196264580 Seq=1440309680 Len=68 Win=64436 Options=<nop,nop,tstamp 568836 388469487>
ip-10-10-0-36.ec2.internal -> pool-100-8-18-194.nwrknj.fios.verizon.net TCP D=40960 S=22 Push Ack=1196264580 Seq=1440309748 Len=52 Win=64436 Options=<nop,nop,tstamp 568836 388469487>
ip-10-10-0-36.ec2.internal -> pool-100-8-18-194.nwrknj.fios.verizon.net TCP D=40960 S=22 Push Ack=1196264580 Seq=1440309800 Len=36 Win=64436 Options=<nop,nop,tstamp 568836 388469487>
ip-10-10-0-36.ec2.internal -> pool-100-8-18-194.nwrknj.fios.verizon.net TCP D=40960 S=22 Push Ack=1196264580 Seq=1440309836 Len=44 Win=64436 Options=<nop,nop,tstamp 568837 388469487>
ip-10-10-0-36.ec2.internal -> pool-100-8-18-194.nwrknj.fios.verizon.net TCP D=40960 S=22 Push Ack=1196264580 Seq=1440309880 Len=44 Win=64436 Options=<nop,nop,tstamp 568837 388469487>
ip-10-10-0-36.ec2.internal -> pool-100-8-18-194.nwrknj.fios.verizon.net TCP D=40960 S=22 Push Ack=1196264580 Seq=1440309924 Len=52 Win=64436 Options=<nop,nop,tstamp 568837 388469487>
ip-10-10-0-36.ec2.internal -> pool-100-8-18-194.nwrknj.fios.verizon.net TCP D=40960 S=22 Push Ack=1196264580 Seq=1440309976 Len=36 Win=64436 Options=<nop,nop,tstamp 568837 388469487>
ip-10-10-0-36.ec2.internal -> pool-100-8-18-194.nwrknj.fios.verizon.net TCP D=40960 S=22 Push Ack=1196264580 Seq=1440310012 Len=52 Win=64436 Options=<nop,nop,tstamp 568837 388469487>
ip-10-10-0-36.ec2.internal -> pool-100-8-18-194.nwrknj.fios.verizon.net TCP D=40960 S=22 Push Ack=1196264580 Seq=1440310064 Len=36 Win=64436 Options=<nop,nop,tstamp 568837 388469487>
ip-10-10-0-36.ec2.internal -> pool-100-8-18-194.nwrknj.fios.verizon.net TCP D=40960 S=22 Push Ack=1196264580 Seq=1440310100 Len=44 Win=64436 Options=<nop,nop,tstamp 568837 388469487>
ip-10-10-0-36.ec2.internal -> pool-100-8-18-194.nwrknj.fios.verizon.net TCP D=40960 S=22 Push Ack=1196264580 Seq=1440310144 Len=52 Win=64436 Options=<nop,nop,tstamp 568837 388469487>
ip-10-10-0-36.ec2.internal -> pool-100-8-18-194.nwrknj.fios.verizon.net TCP D=40960 S=22 Push Ack=1196264580 Seq=1440310196 Len=36 Win=64436 Options=<nop,nop,tstamp 568837 388469487>
ip-10-10-0-36.ec2.internal -> pool-100-8-18-194.nwrknj.fios.verizon.net TCP D=40960 S=22 Push Ack=1196264580 Seq=1440310232 Len=52 Win=64436 Options=<nop,nop,tstamp 568837 388469487>
ip-10-10-0-36.ec2.internal -> pool-100-8-18-194.nwrknj.fios.verizon.net TCP D=40960 S=22 Push Ack=1196264580 Seq=1440310284 Len=44 Win=64436 Options=<nop,nop,tstamp 568837 388469487>
ip-10-10-0-36.ec2.internal -> 104.18.131.28 UDP D=33434 S=33901 LEN=20
pool-100-8-18-194.nwrknj.fios.verizon.net -> ip-10-10-0-36.ec2.internal TCP D=22 S=40960 Ack=1440309532 Seq=1196264580 Len=0 Win=501 Options=<nop,nop,tstamp 388469498 568833>
pool-100-8-18-194.nwrknj.fios.verizon.net -> ip-10-10-0-36.ec2.internal TCP D=22 S=40960 Ack=1440309576 Seq=1196264580 Len=0 Win=501 Options=<nop,nop,tstamp 388469501 568836>
pool-100-8-18-194.nwrknj.fios.verizon.net -> ip-10-10-0-36.ec2.internal TCP D=22 S=40960 Ack=1440309628 Seq=1196264580 Len=0 Win=501 Options=<nop,nop,tstamp 388469501 568836>
pool-100-8-18-194.nwrknj.fios.verizon.net -> ip-10-10-0-36.ec2.internal TCP D=22 S=40960 Ack=1440309680 Seq=1196264580 Len=0 Win=501 Options=<nop,nop,tstamp 388469501 568836>
pool-100-8-18-194.nwrknj.fios.verizon.net -> ip-10-10-0-36.ec2.internal TCP D=22 S=40960 Ack=1440309748 Seq=1196264580 Len=0 Win=501 Options=<nop,nop,tstamp 388469502 568836>
pool-100-8-18-194.nwrknj.fios.verizon.net -> ip-10-10-0-36.ec2.internal TCP D=22 S=40960 Ack=1440309800 Seq=1196264580 Len=0 Win=501 Options=<nop,nop,tstamp 388469502 568836>
pool-100-8-18-194.nwrknj.fios.verizon.net -> ip-10-10-0-36.ec2.internal TCP D=22 S=40960 Ack=1440309836 Seq=1196264580 Len=0 Win=501 Options=<nop,nop,tstamp 388469502 568836>
pool-100-8-18-194.nwrknj.fios.verizon.net -> ip-10-10-0-36.ec2.internal TCP D=22 S=40960 Ack=1440309880 Seq=1196264580 Len=0 Win=501 Options=<nop,nop,tstamp 388469502 568837>
pool-100-8-18-194.nwrknj.fios.verizon.net -> ip-10-10-0-36.ec2.internal TCP D=22 S=40960 Ack=1440309924 Seq=1196264580 Len=0 Win=501 Options=<nop,nop,tstamp 388469502 568837>
pool-100-8-18-194.nwrknj.fios.verizon.net -> ip-10-10-0-36.ec2.internal TCP D=22 S=40960 Ack=1440309976 Seq=1196264580 Len=0 Win=501 Options=<nop,nop,tstamp 388469502 568837>
pool-100-8-18-194.nwrknj.fios.verizon.net -> ip-10-10-0-36.ec2.internal TCP D=22 S=40960 Ack=1440310012 Seq=1196264580 Len=0 Win=501 Options=<nop,nop,tstamp 388469502 568837>
pool-100-8-18-194.nwrknj.fios.verizon.net -> ip-10-10-0-36.ec2.internal TCP D=22 S=40960 Ack=1440310064 Seq=1196264580 Len=0 Win=501 Options=<nop,nop,tstamp 388469502 568837>
pool-100-8-18-194.nwrknj.fios.verizon.net -> ip-10-10-0-36.ec2.internal TCP D=22 S=40960 Ack=1440310100 Seq=1196264580 Len=0 Win=501 Options=<nop,nop,tstamp 388469502 568837>
pool-100-8-18-194.nwrknj.fios.verizon.net -> ip-10-10-0-36.ec2.internal TCP D=22 S=40960 Ack=1440310144 Seq=1196264580 Len=0 Win=501 Options=<nop,nop,tstamp 388469502 568837>
pool-100-8-18-194.nwrknj.fios.verizon.net -> ip-10-10-0-36.ec2.internal TCP D=22 S=40960 Ack=1440310196 Seq=1196264580 Len=0 Win=501 Options=<nop,nop,tstamp 388469502 568837>
pool-100-8-18-194.nwrknj.fios.verizon.net -> ip-10-10-0-36.ec2.internal TCP D=22 S=40960 Ack=1440310232 Seq=1196264580 Len=0 Win=501 Options=<nop,nop,tstamp 388469502 568837>
pool-100-8-18-194.nwrknj.fios.verizon.net -> ip-10-10-0-36.ec2.internal TCP D=22 S=40960 Ack=1440310328 Seq=1196264580 Len=0 Win=501 Options=<nop,nop,tstamp 388469502 568837>
216.182.231.227 -> ip-10-10-0-36.ec2.internal ICMP Time exceeded (in transit)
ip-10-10-0-36.ec2.internal -> ip-10-10-0-2.ec2.internal DNS C 227.231.182.216.in-addr.arpa. Internet PTR ?
ip-10-10-0-2.ec2.internal -> ip-10-10-0-36.ec2.internal DNS R  Error: 3(Name Error)
ip-10-10-0-36.ec2.internal -> ip-10-10-0-2.ec2.internal DNS C 227.231.182.216.in-addr.arpa. Internet PTR ?
ip-10-10-0-2.ec2.internal -> ip-10-10-0-36.ec2.internal DNS R  Error: 3(Name Error)
ip-10-10-0-36.ec2.internal -> pool-100-8-18-194.nwrknj.fios.verizon.net TCP D=40960 S=22 Push Ack=1196264580 Seq=1440310328 Len=84 Win=64436 Options=<nop,nop,tstamp 568883 388469502>
ip-10-10-0-36.ec2.internal -> 104.18.131.28 UDP D=33435 S=33901 LEN=20
pool-100-8-18-194.nwrknj.fios.verizon.net -> ip-10-10-0-36.ec2.internal TCP D=22 S=40960 Ack=1440310412 Seq=1196264580 Len=0 Win=501 Options=<nop,nop,tstamp 388469548 568883>
216.182.226.4 -> ip-10-10-0-36.ec2.internal ICMP Time exceeded (in transit)
ip-10-10-0-36.ec2.internal -> ip-10-10-0-2.ec2.internal DNS C 4.226.182.216.in-addr.arpa. Internet PTR ?
ip-10-10-0-2.ec2.internal -> ip-10-10-0-36.ec2.internal DNS R  Error: 3(Name Error)
ip-10-10-0-36.ec2.internal -> ip-10-10-0-2.ec2.internal DNS C 4.226.182.216.in-addr.arpa. Internet PTR ?
ip-10-10-0-2.ec2.internal -> ip-10-10-0-36.ec2.internal DNS R  Error: 3(Name Error)
ip-10-10-0-36.ec2.internal -> pool-100-8-18-194.nwrknj.fios.verizon.net TCP D=40960 S=22 Push Ack=1196264580 Seq=1440310412 Len=76 Win=64436 Options=<nop,nop,tstamp 568903 388469548>
ip-10-10-0-36.ec2.internal -> 104.18.131.28 UDP D=33436 S=33901 LEN=20
216.182.231.201 -> ip-10-10-0-36.ec2.internal ICMP Time exceeded (in transit)
ip-10-10-0-36.ec2.internal -> ip-10-10-0-2.ec2.internal DNS C 201.231.182.216.in-addr.arpa. Internet PTR ?
ip-10-10-0-2.ec2.internal -> ip-10-10-0-36.ec2.internal DNS R  Error: 3(Name Error)
ip-10-10-0-36.ec2.internal -> ip-10-10-0-2.ec2.internal DNS C 201.231.182.216.in-addr.arpa. Internet PTR ?
ip-10-10-0-2.ec2.internal -> ip-10-10-0-36.ec2.internal DNS R  Error: 3(Name Error)
ip-10-10-0-36.ec2.internal -> pool-100-8-18-194.nwrknj.fios.verizon.net TCP D=40960 S=22 Push Ack=1196264580 Seq=1440310488 Len=84 Win=64436 Options=<nop,nop,tstamp 568914 388469548>
ip-10-10-0-36.ec2.internal -> pool-100-8-18-194.nwrknj.fios.verizon.net TCP D=40960 S=22 Push Ack=1196264580 Seq=1440310572 Len=36 Win=64436 Options=<nop,nop,tstamp 568914 388469548>
ip-10-10-0-36.ec2.internal -> pool-100-8-18-194.nwrknj.fios.verizon.net TCP D=40960 S=22 Push Ack=1196264580 Seq=1440310608 Len=44 Win=64436 Options=<nop,nop,tstamp 568914 388469548>
ip-10-10-0-36.ec2.internal -> 104.18.131.28 UDP D=33437 S=33901 LEN=20
pool-100-8-18-194.nwrknj.fios.verizon.net -> ip-10-10-0-36.ec2.internal TCP D=22 S=40960 Ack=1440310488 Seq=1196264580 Len=0 Win=501 Options=<nop,nop,tstamp 388469568 568903>
pool-100-8-18-194.nwrknj.fios.verizon.net -> ip-10-10-0-36.ec2.internal TCP D=22 S=40960 Ack=1440310608 Seq=1196264580 Len=0 Win=501 Options=<nop,nop,tstamp 388469579 568914>
pool-100-8-18-194.nwrknj.fios.verizon.net -> ip-10-10-0-36.ec2.internal TCP D=22 S=40960 Ack=1440310652 Seq=1196264580 Len=0 Win=501 Options=<nop,nop,tstamp 388469579 568914>
100.66.40.146 -> ip-10-10-0-36.ec2.internal ICMP Time exceeded (in transit)
ip-10-10-0-36.ec2.internal -> ip-10-10-0-2.ec2.internal DNS C 146.40.66.100.in-addr.arpa. Internet PTR ?
ip-10-10-0-2.ec2.internal -> ip-10-10-0-36.ec2.internal DNS R  Error: 3(Name Error)
ip-10-10-0-36.ec2.internal -> ip-10-10-0-2.ec2.internal DNS C 146.40.66.100.in-addr.arpa. Internet PTR ?
ip-10-10-0-2.ec2.internal -> ip-10-10-0-36.ec2.internal DNS R  Error: 3(Name Error)
ip-10-10-0-36.ec2.internal -> pool-100-8-18-194.nwrknj.fios.verizon.net TCP D=40960 S=22 Push Ack=1196264580 Seq=1440310652 Len=76 Win=64436 Options=<nop,nop,tstamp 569036 388469579>
ip-10-10-0-36.ec2.internal -> 104.18.131.28 UDP D=33438 S=33901 LEN=20
pool-100-8-18-194.nwrknj.fios.verizon.net -> ip-10-10-0-36.ec2.internal TCP D=22 S=40960 Ack=1440310728 Seq=1196264580 Len=0 Win=501 Options=<nop,nop,tstamp 388469702 569036>
100.66.8.134 -> ip-10-10-0-36.ec2.internal ICMP Time exceeded (in transit)
ip-10-10-0-36.ec2.internal -> ip-10-10-0-2.ec2.internal DNS C 134.8.66.100.in-addr.arpa. Internet PTR ?
ip-10-10-0-2.ec2.internal -> ip-10-10-0-36.ec2.internal DNS R  Error: 3(Name Error)
ip-10-10-0-36.ec2.internal -> ip-10-10-0-2.ec2.internal DNS C 134.8.66.100.in-addr.arpa. Internet PTR ?
ip-10-10-0-2.ec2.internal -> ip-10-10-0-36.ec2.internal DNS R  Error: 3(Name Error)
ip-10-10-0-36.ec2.internal -> pool-100-8-18-194.nwrknj.fios.verizon.net TCP D=40960 S=22 Push Ack=1196264580 Seq=1440310728 Len=76 Win=64436 Options=<nop,nop,tstamp 569056 388469702>
ip-10-10-0-36.ec2.internal -> 104.18.131.28 UDP D=33439 S=33901 LEN=20
pool-100-8-18-194.nwrknj.fios.verizon.net -> ip-10-10-0-36.ec2.internal TCP D=22 S=40960 Ack=1440310804 Seq=1196264580 Len=0 Win=501 Options=<nop,nop,tstamp 388469721 569056>
ip-10-10-0-36.ec2.internal -> ip-10-10-0-2.ec2.internal DNS C 194.18.8.100.in-addr.arpa. Internet PTR ?
ip-10-10-0-2.ec2.internal -> ip-10-10-0-36.ec2.internal DNS R 194.18.8.100.in-addr.arpa. Internet PTR pool-100-8-18-194.nwrknj.fios.verizon.net.
ip-10-10-0-36.ec2.internal -> ip-10-10-0-2.ec2.internal DNS C 36.0.10.10.in-addr.arpa. Internet PTR ?
ip-10-10-0-2.ec2.internal -> ip-10-10-0-36.ec2.internal DNS R 36.0.10.10.in-addr.arpa. Internet PTR ip-10-10-0-36.ec2.internal.
ip-10-10-0-36.ec2.internal -> ip-10-10-0-2.ec2.internal DNS C 28.131.18.104.in-addr.arpa. Internet PTR ?
ip-10-10-0-2.ec2.internal -> ip-10-10-0-36.ec2.internal DNS R  Error: 3(Name Error)
ip-10-10-0-36.ec2.internal -> ip-10-10-0-2.ec2.internal DNS C 28.131.18.104.in-addr.arpa. Internet PTR ?
ip-10-10-0-2.ec2.internal -> ip-10-10-0-36.ec2.internal DNS R  Error: 3(Name Error)
ip-10-10-0-36.ec2.internal -> ip-10-10-0-2.ec2.internal DNS C 227.231.182.216.in-addr.arpa. Internet PTR ?
ip-10-10-0-2.ec2.internal -> ip-10-10-0-36.ec2.internal DNS R  Error: 3(Name Error)
ip-10-10-0-36.ec2.internal -> ip-10-10-0-2.ec2.internal DNS C 227.231.182.216.in-addr.arpa. Internet PTR ?
ip-10-10-0-2.ec2.internal -> ip-10-10-0-36.ec2.internal DNS R  Error: 3(Name Error)
ip-10-10-0-36.ec2.internal -> ip-10-10-0-2.ec2.internal DNS C 2.0.10.10.in-addr.arpa. Internet PTR ?
ip-10-10-0-2.ec2.internal -> ip-10-10-0-36.ec2.internal DNS R 2.0.10.10.in-addr.arpa. Internet PTR ip-10-10-0-2.ec2.internal.
ip-10-10-0-36.ec2.internal -> ip-10-10-0-2.ec2.internal DNS C 4.226.182.216.in-addr.arpa. Internet PTR ?
ip-10-10-0-2.ec2.internal -> ip-10-10-0-36.ec2.internal DNS R  Error: 3(Name Error)
ip-10-10-0-36.ec2.internal -> ip-10-10-0-2.ec2.internal DNS C 4.226.182.216.in-addr.arpa. Internet PTR ?
ip-10-10-0-2.ec2.internal -> ip-10-10-0-36.ec2.internal DNS R  Error: 3(Name Error)
ip-10-10-0-36.ec2.internal -> ip-10-10-0-2.ec2.internal DNS C 201.231.182.216.in-addr.arpa. Internet PTR ?
ip-10-10-0-2.ec2.internal -> ip-10-10-0-36.ec2.internal DNS R  Error: 3(Name Error)
ip-10-10-0-36.ec2.internal -> ip-10-10-0-2.ec2.internal DNS C 201.231.182.216.in-addr.arpa. Internet PTR ?
ip-10-10-0-2.ec2.internal -> ip-10-10-0-36.ec2.internal DNS R  Error: 3(Name Error)
ip-10-10-0-36.ec2.internal -> ip-10-10-0-2.ec2.internal DNS C 146.40.66.100.in-addr.arpa. Internet PTR ?
ip-10-10-0-2.ec2.internal -> ip-10-10-0-36.ec2.internal DNS R  Error: 3(Name Error)
ip-10-10-0-36.ec2.internal -> ip-10-10-0-2.ec2.internal DNS C 146.40.66.100.in-addr.arpa. Internet PTR ?
ip-10-10-0-2.ec2.internal -> ip-10-10-0-36.ec2.internal DNS R  Error: 3(Name Error)
ip-10-10-0-36.ec2.internal -> ip-10-10-0-2.ec2.internal DNS C 134.8.66.100.in-addr.arpa. Internet PTR ?
ip-10-10-0-2.ec2.internal -> ip-10-10-0-36.ec2.internal DNS R  Error: 3(Name Error)
ip-10-10-0-36.ec2.internal -> ip-10-10-0-2.ec2.internal DNS C 134.8.66.100.in-addr.arpa. Internet PTR ?
ip-10-10-0-2.ec2.internal -> ip-10-10-0-36.ec2.internal DNS R  Error: 3(Name Error)
 100.66.8.56 -> ip-10-10-0-36.ec2.internal ICMP Time exceeded (in transit)
ip-10-10-0-36.ec2.internal -> ip-10-10-0-2.ec2.internal DNS C 56.8.66.100.in-addr.arpa. Internet PTR ?
ip-10-10-0-2.ec2.internal -> ip-10-10-0-36.ec2.internal DNS R  Error: 3(Name Error)
ip-10-10-0-36.ec2.internal -> ip-10-10-0-2.ec2.internal DNS C 56.8.66.100.in-addr.arpa. Internet PTR ?
ip-10-10-0-2.ec2.internal -> ip-10-10-0-36.ec2.internal DNS R  Error: 3(Name Error)
ip-10-10-0-36.ec2.internal -> pool-100-8-18-194.nwrknj.fios.verizon.net TCP D=40960 S=22 Push Ack=1196264580 Seq=1440310804 Len=76 Win=64436 Options=<nop,nop,tstamp 569277 388469721>
ip-10-10-0-36.ec2.internal -> pool-100-8-18-194.nwrknj.fios.verizon.net TCP D=40960 S=22 Push Ack=1196264580 Seq=1440310880 Len=36 Win=64436 Options=<nop,nop,tstamp 569277 388469721>
ip-10-10-0-36.ec2.internal -> pool-100-8-18-194.nwrknj.fios.verizon.net TCP D=40960 S=22 Push Ack=1196264580 Seq=1440310916 Len=44 Win=64436 Options=<nop,nop,tstamp 569277 388469721>
ip-10-10-0-36.ec2.internal -> 104.18.131.28 UDP D=33440 S=33901 LEN=20
pool-100-8-18-194.nwrknj.fios.verizon.net -> ip-10-10-0-36.ec2.internal TCP D=22 S=40960 Ack=1440310880 Seq=1196264580 Len=0 Win=501 Options=<nop,nop,tstamp 388469942 569277>
pool-100-8-18-194.nwrknj.fios.verizon.net -> ip-10-10-0-36.ec2.internal TCP D=22 S=40960 Ack=1440310916 Seq=1196264580 Len=0 Win=501 Options=<nop,nop,tstamp 388469942 569277>
pool-100-8-18-194.nwrknj.fios.verizon.net -> ip-10-10-0-36.ec2.internal TCP D=22 S=40960 Ack=1440310960 Seq=1196264580 Len=0 Win=501 Options=<nop,nop,tstamp 388469942 569277>
100.66.11.30 -> ip-10-10-0-36.ec2.internal ICMP Time exceeded (in transit)
ip-10-10-0-36.ec2.internal -> ip-10-10-0-2.ec2.internal DNS C 30.11.66.100.in-addr.arpa. Internet PTR ?
ip-10-10-0-2.ec2.internal -> ip-10-10-0-36.ec2.internal DNS R  Error: 3(Name Error)
ip-10-10-0-36.ec2.internal -> ip-10-10-0-2.ec2.internal DNS C 30.11.66.100.in-addr.arpa. Internet PTR ?
ip-10-10-0-2.ec2.internal -> ip-10-10-0-36.ec2.internal DNS R  Error: 3(Name Error)
ip-10-10-0-36.ec2.internal -> pool-100-8-18-194.nwrknj.fios.verizon.net TCP D=40960 S=22 Push Ack=1196264580 Seq=1440310960 Len=76 Win=64436 Options=<nop,nop,tstamp 569422 388469942>
ip-10-10-0-36.ec2.internal -> 104.18.131.28 UDP D=33441 S=33901 LEN=20
pool-100-8-18-194.nwrknj.fios.verizon.net -> ip-10-10-0-36.ec2.internal TCP D=22 S=40960 Ack=1440311036 Seq=1196264580 Len=0 Win=501 Options=<nop,nop,tstamp 388470087 569422>
100.66.15.106 -> ip-10-10-0-36.ec2.internal ICMP Time exceeded (in transit)
ip-10-10-0-36.ec2.internal -> ip-10-10-0-2.ec2.internal DNS C 106.15.66.100.in-addr.arpa. Internet PTR ?
ip-10-10-0-2.ec2.internal -> ip-10-10-0-36.ec2.internal DNS R  Error: 3(Name Error)
ip-10-10-0-36.ec2.internal -> ip-10-10-0-2.ec2.internal DNS C 106.15.66.100.in-addr.arpa. Internet PTR ?
ip-10-10-0-2.ec2.internal -> ip-10-10-0-36.ec2.internal DNS R  Error: 3(Name Error)
ip-10-10-0-36.ec2.internal -> pool-100-8-18-194.nwrknj.fios.verizon.net TCP D=40960 S=22 Push Ack=1196264580 Seq=1440311036 Len=76 Win=64436 Options=<nop,nop,tstamp 569437 388470087>
ip-10-10-0-36.ec2.internal -> 104.18.131.28 UDP D=33442 S=33901 LEN=20
pool-100-8-18-194.nwrknj.fios.verizon.net -> ip-10-10-0-36.ec2.internal TCP D=22 S=40960 Ack=1440311112 Seq=1196264580 Len=0 Win=501 Options=<nop,nop,tstamp 388470102 569437>
100.66.43.68 -> ip-10-10-0-36.ec2.internal ICMP Time exceeded (in transit)
ip-10-10-0-36.ec2.internal -> ip-10-10-0-2.ec2.internal DNS C 68.43.66.100.in-addr.arpa. Internet PTR ?
ip-10-10-0-2.ec2.internal -> ip-10-10-0-36.ec2.internal DNS R  Error: 3(Name Error)
ip-10-10-0-36.ec2.internal -> ip-10-10-0-2.ec2.internal DNS C 68.43.66.100.in-addr.arpa. Internet PTR ?
ip-10-10-0-2.ec2.internal -> ip-10-10-0-36.ec2.internal DNS R  Error: 3(Name Error)
ip-10-10-0-36.ec2.internal -> pool-100-8-18-194.nwrknj.fios.verizon.net TCP D=40960 S=22 Push Ack=1196264580 Seq=1440311112 Len=76 Win=64436 Options=<nop,nop,tstamp 569453 388470102>
ip-10-10-0-36.ec2.internal -> pool-100-8-18-194.nwrknj.fios.verizon.net TCP D=40960 S=22 Push Ack=1196264580 Seq=1440311188 Len=36 Win=64436 Options=<nop,nop,tstamp 569453 388470102>
ip-10-10-0-36.ec2.internal -> pool-100-8-18-194.nwrknj.fios.verizon.net TCP D=40960 S=22 Push Ack=1196264580 Seq=1440311224 Len=44 Win=64436 Options=<nop,nop,tstamp 569453 388470102>
ip-10-10-0-36.ec2.internal -> 104.18.131.28 UDP D=33443 S=33901 LEN=20
  241.0.6.10 -> ip-10-10-0-36.ec2.internal ICMP Time exceeded (in transit)
ip-10-10-0-36.ec2.internal -> ip-10-10-0-2.ec2.internal DNS C 10.6.0.241.in-addr.arpa. Internet PTR ?
ip-10-10-0-2.ec2.internal -> ip-10-10-0-36.ec2.internal DNS R  Error: 3(Name Error)
ip-10-10-0-36.ec2.internal -> ip-10-10-0-2.ec2.internal DNS C 10.6.0.241.in-addr.arpa. Internet PTR ?
ip-10-10-0-2.ec2.internal -> ip-10-10-0-36.ec2.internal DNS R  Error: 3(Name Error)
ip-10-10-0-36.ec2.internal -> pool-100-8-18-194.nwrknj.fios.verizon.net TCP D=40960 S=22 Push Ack=1196264580 Seq=1440311268 Len=68 Win=64436 Options=<nop,nop,tstamp 569459 388470102>
ip-10-10-0-36.ec2.internal -> 104.18.131.28 UDP D=33444 S=33901 LEN=20
pool-100-8-18-194.nwrknj.fios.verizon.net -> ip-10-10-0-36.ec2.internal TCP D=22 S=40960 Ack=1440311188 Seq=1196264580 Len=0 Win=501 Options=<nop,nop,tstamp 388470118 569453>
pool-100-8-18-194.nwrknj.fios.verizon.net -> ip-10-10-0-36.ec2.internal TCP D=22 S=40960 Ack=1440311224 Seq=1196264580 Len=0 Win=501 Options=<nop,nop,tstamp 388470118 569453>
pool-100-8-18-194.nwrknj.fios.verizon.net -> ip-10-10-0-36.ec2.internal TCP D=22 S=40960 Ack=1440311268 Seq=1196264580 Len=0 Win=501 Options=<nop,nop,tstamp 388470118 569453>
pool-100-8-18-194.nwrknj.fios.verizon.net -> ip-10-10-0-36.ec2.internal TCP D=22 S=40960 Ack=1440311336 Seq=1196264580 Len=0 Win=501 Options=<nop,nop,tstamp 388470124 569459>
100.66.55.180 -> ip-10-10-0-36.ec2.internal ICMP Time exceeded (in transit)
ip-10-10-0-36.ec2.internal -> ip-10-10-0-2.ec2.internal DNS C 180.55.66.100.in-addr.arpa. Internet PTR ?
ip-10-10-0-2.ec2.internal -> ip-10-10-0-36.ec2.internal DNS R  Error: 3(Name Error)
ip-10-10-0-36.ec2.internal -> ip-10-10-0-2.ec2.internal DNS C 180.55.66.100.in-addr.arpa. Internet PTR ?
ip-10-10-0-2.ec2.internal -> ip-10-10-0-36.ec2.internal DNS R  Error: 3(Name Error)
ip-10-10-0-36.ec2.internal -> pool-100-8-18-194.nwrknj.fios.verizon.net TCP D=40960 S=22 Push Ack=1196264580 Seq=1440311336 Len=76 Win=64436 Options=<nop,nop,tstamp 569481 388470124>
ip-10-10-0-36.ec2.internal -> 104.18.131.28 UDP D=33445 S=33901 LEN=20
  241.0.6.26 -> ip-10-10-0-36.ec2.internal ICMP Time exceeded (in transit)
ip-10-10-0-36.ec2.internal -> ip-10-10-0-2.ec2.internal DNS C 26.6.0.241.in-addr.arpa. Internet PTR ?
pool-100-8-18-194.nwrknj.fios.verizon.net -> ip-10-10-0-36.ec2.internal TCP D=22 S=40960 Ack=1440311412 Seq=1196264580 Len=0 Win=501 Options=<nop,nop,tstamp 388470146 569481>
ip-10-10-0-2.ec2.internal -> ip-10-10-0-36.ec2.internal DNS R  Error: 3(Name Error)
ip-10-10-0-36.ec2.internal -> ip-10-10-0-2.ec2.internal DNS C 26.6.0.241.in-addr.arpa. Internet PTR ?
ip-10-10-0-2.ec2.internal -> ip-10-10-0-36.ec2.internal DNS R  Error: 3(Name Error)
ip-10-10-0-36.ec2.internal -> pool-100-8-18-194.nwrknj.fios.verizon.net TCP D=40960 S=22 Push Ack=1196264580 Seq=1440311412 Len=68 Win=64436 Options=<nop,nop,tstamp 569548 388470146>
ip-10-10-0-36.ec2.internal -> pool-100-8-18-194.nwrknj.fios.verizon.net TCP D=40960 S=22 Push Ack=1196264580 Seq=1440311480 Len=36 Win=64436 Options=<nop,nop,tstamp 569548 388470146>
ip-10-10-0-36.ec2.internal -> pool-100-8-18-194.nwrknj.fios.verizon.net TCP D=40960 S=22 Push Ack=1196264580 Seq=1440311516 Len=44 Win=64436 Options=<nop,nop,tstamp 569548 388470146>
ip-10-10-0-36.ec2.internal -> 104.18.131.28 UDP D=33446 S=33901 LEN=20
 240.0.48.31 -> ip-10-10-0-36.ec2.internal ICMP Time exceeded (in transit)
ip-10-10-0-36.ec2.internal -> ip-10-10-0-2.ec2.internal DNS C 31.48.0.240.in-addr.arpa. Internet PTR ?
ip-10-10-0-2.ec2.internal -> ip-10-10-0-36.ec2.internal DNS R  Error: 3(Name Error)
ip-10-10-0-36.ec2.internal -> ip-10-10-0-2.ec2.internal DNS C 31.48.0.240.in-addr.arpa. Internet PTR ?
ip-10-10-0-2.ec2.internal -> ip-10-10-0-36.ec2.internal DNS R  Error: 3(Name Error)
ip-10-10-0-36.ec2.internal -> pool-100-8-18-194.nwrknj.fios.verizon.net TCP D=40960 S=22 Push Ack=1196264580 Seq=1440311560 Len=76 Win=64436 Options=<nop,nop,tstamp 569553 388470146>
ip-10-10-0-36.ec2.internal -> 104.18.131.28 UDP D=33447 S=33901 LEN=20
 240.0.48.26 -> ip-10-10-0-36.ec2.internal ICMP Time exceeded (in transit)
ip-10-10-0-36.ec2.internal -> ip-10-10-0-2.ec2.internal DNS C 26.48.0.240.in-addr.arpa. Internet PTR ?
ip-10-10-0-2.ec2.internal -> ip-10-10-0-36.ec2.internal DNS R  Error: 3(Name Error)
ip-10-10-0-36.ec2.internal -> ip-10-10-0-2.ec2.internal DNS C 26.48.0.240.in-addr.arpa. Internet PTR ?
ip-10-10-0-2.ec2.internal -> ip-10-10-0-36.ec2.internal DNS R  Error: 3(Name Error)
ip-10-10-0-36.ec2.internal -> pool-100-8-18-194.nwrknj.fios.verizon.net TCP D=40960 S=22 Push Ack=1196264580 Seq=1440311636 Len=76 Win=64436 Options=<nop,nop,tstamp 569558 388470146>
ip-10-10-0-36.ec2.internal -> 104.18.131.28 UDP D=33448 S=33901 LEN=20
 240.0.48.31 -> ip-10-10-0-36.ec2.internal ICMP Time exceeded (in transit)
ip-10-10-0-36.ec2.internal -> ip-10-10-0-2.ec2.internal DNS C 31.48.0.240.in-addr.arpa. Internet PTR ?
ip-10-10-0-2.ec2.internal -> ip-10-10-0-36.ec2.internal DNS R  Error: 3(Name Error)
ip-10-10-0-36.ec2.internal -> ip-10-10-0-2.ec2.internal DNS C 31.48.0.240.in-addr.arpa. Internet PTR ?
ip-10-10-0-2.ec2.internal -> ip-10-10-0-36.ec2.internal DNS R  Error: 3(Name Error)
pool-100-8-18-194.nwrknj.fios.verizon.net -> ip-10-10-0-36.ec2.internal TCP D=22 S=40960 Ack=1440311480 Seq=1196264580 Len=0 Win=501 Options=<nop,nop,tstamp 388470213 569548>
pool-100-8-18-194.nwrknj.fios.verizon.net -> ip-10-10-0-36.ec2.internal TCP D=22 S=40960 Ack=1440311516 Seq=1196264580 Len=0 Win=501 Options=<nop,nop,tstamp 388470213 569548>
pool-100-8-18-194.nwrknj.fios.verizon.net -> ip-10-10-0-36.ec2.internal TCP D=22 S=40960 Ack=1440311560 Seq=1196264580 Len=0 Win=501 Options=<nop,nop,tstamp 388470213 569548>
ip-10-10-0-36.ec2.internal -> pool-100-8-18-194.nwrknj.fios.verizon.net TCP D=40960 S=22 Push Ack=1196264580 Seq=1440311712 Len=76 Win=64436 Options=<nop,nop,tstamp 569560 388470213>
ip-10-10-0-36.ec2.internal -> pool-100-8-18-194.nwrknj.fios.verizon.net TCP D=40960 S=22 Push Ack=1196264580 Seq=1440311788 Len=36 Win=64436 Options=<nop,nop,tstamp 569560 388470213>
ip-10-10-0-36.ec2.internal -> pool-100-8-18-194.nwrknj.fios.verizon.net TCP D=40960 S=22 Push Ack=1196264580 Seq=1440311824 Len=44 Win=64436 Options=<nop,nop,tstamp 569560 388470213>
ip-10-10-0-36.ec2.internal -> 104.18.131.28 UDP D=33449 S=33901 LEN=20
 240.0.48.30 -> ip-10-10-0-36.ec2.internal ICMP Time exceeded (in transit)
ip-10-10-0-36.ec2.internal -> ip-10-10-0-2.ec2.internal DNS C 30.48.0.240.in-addr.arpa. Internet PTR ?
ip-10-10-0-2.ec2.internal -> ip-10-10-0-36.ec2.internal DNS R  Error: 3(Name Error)
ip-10-10-0-36.ec2.internal -> ip-10-10-0-2.ec2.internal DNS C 30.48.0.240.in-addr.arpa. Internet PTR ?
ip-10-10-0-2.ec2.internal -> ip-10-10-0-36.ec2.internal DNS R  Error: 3(Name Error)
pool-100-8-18-194.nwrknj.fios.verizon.net -> ip-10-10-0-36.ec2.internal TCP D=22 S=40960 Ack=1440311636 Seq=1196264580 Len=0 Win=501 Options=<nop,nop,tstamp 388470218 569553>
ip-10-10-0-36.ec2.internal -> pool-100-8-18-194.nwrknj.fios.verizon.net TCP D=40960 S=22 Push Ack=1196264580 Seq=1440311868 Len=76 Win=64436 Options=<nop,nop,tstamp 569564 388470218>
ip-10-10-0-36.ec2.internal -> 104.18.131.28 UDP D=33450 S=33901 LEN=20
242.0.154.161 -> ip-10-10-0-36.ec2.internal ICMP Time exceeded (in transit)
ip-10-10-0-36.ec2.internal -> ip-10-10-0-2.ec2.internal DNS C 161.154.0.242.in-addr.arpa. Internet PTR ?
ip-10-10-0-2.ec2.internal -> ip-10-10-0-36.ec2.internal DNS R  Error: 3(Name Error)
ip-10-10-0-36.ec2.internal -> ip-10-10-0-2.ec2.internal DNS C 161.154.0.242.in-addr.arpa. Internet PTR ?
pool-100-8-18-194.nwrknj.fios.verizon.net -> ip-10-10-0-36.ec2.internal TCP D=22 S=40960 Ack=1440311712 Seq=1196264580 Len=0 Win=501 Options=<nop,nop,tstamp 388470223 569558>
ip-10-10-0-2.ec2.internal -> ip-10-10-0-36.ec2.internal DNS R  Error: 3(Name Error)
ip-10-10-0-36.ec2.internal -> pool-100-8-18-194.nwrknj.fios.verizon.net TCP D=40960 S=22 Push Ack=1196264580 Seq=1440311944 Len=76 Win=64436 Options=<nop,nop,tstamp 569569 388470223>
ip-10-10-0-36.ec2.internal -> 104.18.131.28 UDP D=33451 S=33901 LEN=20
242.0.154.49 -> ip-10-10-0-36.ec2.internal ICMP Time exceeded (in transit)
ip-10-10-0-36.ec2.internal -> ip-10-10-0-2.ec2.internal DNS C 49.154.0.242.in-addr.arpa. Internet PTR ?
pool-100-8-18-194.nwrknj.fios.verizon.net -> ip-10-10-0-36.ec2.internal TCP D=22 S=40960 Ack=1440311788 Seq=1196264580 Len=0 Win=501 Options=<nop,nop,tstamp 388470225 569560>
pool-100-8-18-194.nwrknj.fios.verizon.net -> ip-10-10-0-36.ec2.internal TCP D=22 S=40960 Ack=1440311824 Seq=1196264580 Len=0 Win=501 Options=<nop,nop,tstamp 388470225 569560>
pool-100-8-18-194.nwrknj.fios.verizon.net -> ip-10-10-0-36.ec2.internal TCP D=22 S=40960 Ack=1440311868 Seq=1196264580 Len=0 Win=501 Options=<nop,nop,tstamp 388470225 569560>
pool-100-8-18-194.nwrknj.fios.verizon.net -> ip-10-10-0-36.ec2.internal TCP D=22 S=40960 Ack=1440311944 Seq=1196264580 Len=0 Win=501 Options=<nop,nop,tstamp 388470229 569564>
pool-100-8-18-194.nwrknj.fios.verizon.net -> ip-10-10-0-36.ec2.internal TCP D=22 S=40960 Ack=1440312020 Seq=1196264580 Len=0 Win=501 Options=<nop,nop,tstamp 388470234 569569>
ip-10-10-0-2.ec2.internal -> ip-10-10-0-36.ec2.internal DNS R  Error: 3(Name Error)
ip-10-10-0-36.ec2.internal -> ip-10-10-0-2.ec2.internal DNS C 49.154.0.242.in-addr.arpa. Internet PTR ?
ip-10-10-0-2.ec2.internal -> ip-10-10-0-36.ec2.internal DNS R  Error: 3(Name Error)
ip-10-10-0-36.ec2.internal -> pool-100-8-18-194.nwrknj.fios.verizon.net TCP D=40960 S=22 Push Ack=1196264580 Seq=1440312020 Len=76 Win=64436 Options=<nop,nop,tstamp 569636 388470234>
ip-10-10-0-36.ec2.internal -> pool-100-8-18-194.nwrknj.fios.verizon.net TCP D=40960 S=22 Push Ack=1196264580 Seq=1440312096 Len=36 Win=64436 Options=<nop,nop,tstamp 569636 388470234>
ip-10-10-0-36.ec2.internal -> pool-100-8-18-194.nwrknj.fios.verizon.net TCP D=40960 S=22 Push Ack=1196264580 Seq=1440312132 Len=44 Win=64436 Options=<nop,nop,tstamp 569636 388470234>
ip-10-10-0-36.ec2.internal -> 104.18.131.28 UDP D=33452 S=33901 LEN=20
52.93.28.135 -> ip-10-10-0-36.ec2.internal ICMP Time exceeded (in transit)
ip-10-10-0-36.ec2.internal -> ip-10-10-0-2.ec2.internal DNS C 135.28.93.52.in-addr.arpa. Internet PTR ?
ip-10-10-0-2.ec2.internal -> ip-10-10-0-36.ec2.internal DNS R  Error: 3(Name Error)
ip-10-10-0-36.ec2.internal -> ip-10-10-0-2.ec2.internal DNS C 135.28.93.52.in-addr.arpa. Internet PTR ?
ip-10-10-0-2.ec2.internal -> ip-10-10-0-36.ec2.internal DNS R  Error: 3(Name Error)
ip-10-10-0-36.ec2.internal -> pool-100-8-18-194.nwrknj.fios.verizon.net TCP D=40960 S=22 Push Ack=1196264580 Seq=1440312176 Len=76 Win=64436 Options=<nop,nop,tstamp 569641 388470234>
ip-10-10-0-36.ec2.internal -> 104.18.131.28 UDP D=33453 S=33901 LEN=20
52.93.28.109 -> ip-10-10-0-36.ec2.internal ICMP Time exceeded (in transit)
ip-10-10-0-36.ec2.internal -> ip-10-10-0-2.ec2.internal DNS C 109.28.93.52.in-addr.arpa. Internet PTR ?
ip-10-10-0-2.ec2.internal -> ip-10-10-0-36.ec2.internal DNS R  Error: 3(Name Error)
ip-10-10-0-36.ec2.internal -> ip-10-10-0-2.ec2.internal DNS C 109.28.93.52.in-addr.arpa. Internet PTR ?
ip-10-10-0-2.ec2.internal -> ip-10-10-0-36.ec2.internal DNS R  Error: 3(Name Error)
ip-10-10-0-36.ec2.internal -> pool-100-8-18-194.nwrknj.fios.verizon.net TCP D=40960 S=22 Push Ack=1196264580 Seq=1440312252 Len=76 Win=64436 Options=<nop,nop,tstamp 569646 388470234>
ip-10-10-0-36.ec2.internal -> 104.18.131.28 UDP D=33454 S=33901 LEN=20
 52.93.28.91 -> ip-10-10-0-36.ec2.internal ICMP Time exceeded (in transit)
ip-10-10-0-36.ec2.internal -> ip-10-10-0-2.ec2.internal DNS C 91.28.93.52.in-addr.arpa. Internet PTR ?
pool-100-8-18-194.nwrknj.fios.verizon.net -> ip-10-10-0-36.ec2.internal TCP D=22 S=40960 Ack=1440312132 Seq=1196264580 Len=0 Win=501 Options=<nop,nop,tstamp 388470301 569636>
pool-100-8-18-194.nwrknj.fios.verizon.net -> ip-10-10-0-36.ec2.internal TCP D=22 S=40960 Ack=1440312176 Seq=1196264580 Len=0 Win=501 Options=<nop,nop,tstamp 388470301 569636>
ip-10-10-0-2.ec2.internal -> ip-10-10-0-36.ec2.internal DNS R  Error: 3(Name Error)
ip-10-10-0-36.ec2.internal -> ip-10-10-0-2.ec2.internal DNS C 91.28.93.52.in-addr.arpa. Internet PTR ?
ip-10-10-0-2.ec2.internal -> ip-10-10-0-36.ec2.internal DNS R  Error: 3(Name Error)
ip-10-10-0-36.ec2.internal -> pool-100-8-18-194.nwrknj.fios.verizon.net TCP D=40960 S=22 Push Ack=1196264580 Seq=1440312328 Len=76 Win=64436 Options=<nop,nop,tstamp 569650 388470301>
ip-10-10-0-36.ec2.internal -> pool-100-8-18-194.nwrknj.fios.verizon.net TCP D=40960 S=22 Push Ack=1196264580 Seq=1440312404 Len=36 Win=64436 Options=<nop,nop,tstamp 569650 388470301>
ip-10-10-0-36.ec2.internal -> pool-100-8-18-194.nwrknj.fios.verizon.net TCP D=40960 S=22 Push Ack=1196264580 Seq=1440312440 Len=44 Win=64436 Options=<nop,nop,tstamp 569650 388470301>
ip-10-10-0-36.ec2.internal -> 104.18.131.28 UDP D=33455 S=33901 LEN=20
100.100.34.46 -> ip-10-10-0-36.ec2.internal ICMP Time exceeded (in transit)
ip-10-10-0-36.ec2.internal -> ip-10-10-0-2.ec2.internal DNS C 46.34.100.100.in-addr.arpa. Internet PTR ?
pool-100-8-18-194.nwrknj.fios.verizon.net -> ip-10-10-0-36.ec2.internal TCP D=22 S=40960 Ack=1440312252 Seq=1196264580 Len=0 Win=501 Options=<nop,nop,tstamp 388470306 569641>
ip-10-10-0-2.ec2.internal -> ip-10-10-0-36.ec2.internal DNS R  Error: 3(Name Error)
ip-10-10-0-36.ec2.internal -> ip-10-10-0-2.ec2.internal DNS C 46.34.100.100.in-addr.arpa. Internet PTR ?
ip-10-10-0-2.ec2.internal -> ip-10-10-0-36.ec2.internal DNS R  Error: 3(Name Error)
ip-10-10-0-36.ec2.internal -> pool-100-8-18-194.nwrknj.fios.verizon.net TCP D=40960 S=22 Push Ack=1196264580 Seq=1440312484 Len=76 Win=64436 Options=<nop,nop,tstamp 569655 388470306>
ip-10-10-0-36.ec2.internal -> 104.18.131.28 UDP D=33456 S=33901 LEN=20
100.100.34.90 -> ip-10-10-0-36.ec2.internal ICMP Time exceeded (in transit)
ip-10-10-0-36.ec2.internal -> ip-10-10-0-2.ec2.internal DNS C 90.34.100.100.in-addr.arpa. Internet PTR ?
pool-100-8-18-194.nwrknj.fios.verizon.net -> ip-10-10-0-36.ec2.internal TCP D=22 S=40960 Ack=1440312328 Seq=1196264580 Len=0 Win=501 Options=<nop,nop,tstamp 388470311 569646>
ip-10-10-0-2.ec2.internal -> ip-10-10-0-36.ec2.internal DNS R  Error: 3(Name Error)
ip-10-10-0-36.ec2.internal -> ip-10-10-0-2.ec2.internal DNS C 90.34.100.100.in-addr.arpa. Internet PTR ?
ip-10-10-0-2.ec2.internal -> ip-10-10-0-36.ec2.internal DNS R  Error: 3(Name Error)
ip-10-10-0-36.ec2.internal -> pool-100-8-18-194.nwrknj.fios.verizon.net TCP D=40960 S=22 Push Ack=1196264580 Seq=1440312560 Len=76 Win=64436 Options=<nop,nop,tstamp 569659 388470311>
ip-10-10-0-36.ec2.internal -> 104.18.131.28 UDP D=33457 S=33901 LEN=20
52.93.28.121 -> ip-10-10-0-36.ec2.internal ICMP Time exceeded (in transit)
pool-100-8-18-194.nwrknj.fios.verizon.net -> ip-10-10-0-36.ec2.internal TCP D=22 S=40960 Ack=1440312440 Seq=1196264580 Len=0 Win=501 Options=<nop,nop,tstamp 388470315 569650>
pool-100-8-18-194.nwrknj.fios.verizon.net -> ip-10-10-0-36.ec2.internal TCP D=22 S=40960 Ack=1440312484 Seq=1196264580 Len=0 Win=501 Options=<nop,nop,tstamp 388470315 569650>
ip-10-10-0-36.ec2.internal -> ip-10-10-0-2.ec2.internal DNS C 121.28.93.52.in-addr.arpa. Internet PTR ?
pool-100-8-18-194.nwrknj.fios.verizon.net -> ip-10-10-0-36.ec2.internal TCP D=22 S=40960 Ack=1440312560 Seq=1196264580 Len=0 Win=501 Options=<nop,nop,tstamp 388470320 569655>
pool-100-8-18-194.nwrknj.fios.verizon.net -> ip-10-10-0-36.ec2.internal TCP D=22 S=40960 Ack=1440312636 Seq=1196264580 Len=0 Win=501 Options=<nop,nop,tstamp 388470324 569659>
ip-10-10-0-2.ec2.internal -> ip-10-10-0-36.ec2.internal DNS R  Error: 3(Name Error)
ip-10-10-0-36.ec2.internal -> ip-10-10-0-2.ec2.internal DNS C 121.28.93.52.in-addr.arpa. Internet PTR ?
ip-10-10-0-2.ec2.internal -> ip-10-10-0-36.ec2.internal DNS R  Error: 3(Name Error)
ip-10-10-0-36.ec2.internal -> pool-100-8-18-194.nwrknj.fios.verizon.net TCP D=40960 S=22 Push Ack=1196264580 Seq=1440312636 Len=76 Win=64436 Options=<nop,nop,tstamp 569787 388470324>
ip-10-10-0-36.ec2.internal -> pool-100-8-18-194.nwrknj.fios.verizon.net TCP D=40960 S=22 Push Ack=1196264580 Seq=1440312712 Len=36 Win=64436 Options=<nop,nop,tstamp 569787 388470324>
ip-10-10-0-36.ec2.internal -> pool-100-8-18-194.nwrknj.fios.verizon.net TCP D=40960 S=22 Push Ack=1196264580 Seq=1440312748 Len=44 Win=64436 Options=<nop,nop,tstamp 569787 388470324>
ip-10-10-0-36.ec2.internal -> 104.18.131.28 UDP D=33458 S=33901 LEN=20
100.100.34.36 -> ip-10-10-0-36.ec2.internal ICMP Time exceeded (in transit)
ip-10-10-0-36.ec2.internal -> ip-10-10-0-2.ec2.internal DNS C 36.34.100.100.in-addr.arpa. Internet PTR ?
ip-10-10-0-2.ec2.internal -> ip-10-10-0-36.ec2.internal DNS R  Error: 3(Name Error)
ip-10-10-0-36.ec2.internal -> ip-10-10-0-2.ec2.internal DNS C 36.34.100.100.in-addr.arpa. Internet PTR ?
ip-10-10-0-2.ec2.internal -> ip-10-10-0-36.ec2.internal DNS R  Error: 3(Name Error)
ip-10-10-0-36.ec2.internal -> pool-100-8-18-194.nwrknj.fios.verizon.net TCP D=40960 S=22 Push Ack=1196264580 Seq=1440312792 Len=76 Win=64436 Options=<nop,nop,tstamp 569791 388470324>
ip-10-10-0-36.ec2.internal -> 104.18.131.28 UDP D=33459 S=33901 LEN=20
99.83.90.167 -> ip-10-10-0-36.ec2.internal ICMP Time exceeded (in transit)
ip-10-10-0-36.ec2.internal -> ip-10-10-0-2.ec2.internal DNS C 167.90.83.99.in-addr.arpa. Internet PTR ?
ip-10-10-0-2.ec2.internal -> ip-10-10-0-36.ec2.internal DNS R  Error: 3(Name Error)
ip-10-10-0-36.ec2.internal -> ip-10-10-0-2.ec2.internal DNS C 167.90.83.99.in-addr.arpa. Internet PTR ?
ip-10-10-0-2.ec2.internal -> ip-10-10-0-36.ec2.internal DNS R  Error: 3(Name Error)
ip-10-10-0-36.ec2.internal -> pool-100-8-18-194.nwrknj.fios.verizon.net TCP D=40960 S=22 Push Ack=1196264580 Seq=1440312868 Len=76 Win=64436 Options=<nop,nop,tstamp 569794 388470324>
ip-10-10-0-36.ec2.internal -> 104.18.131.28 UDP D=33460 S=33901 LEN=20
 99.83.90.51 -> ip-10-10-0-36.ec2.internal ICMP Time exceeded (in transit)
ip-10-10-0-36.ec2.internal -> ip-10-10-0-2.ec2.internal DNS C 51.90.83.99.in-addr.arpa. Internet PTR ?
ip-10-10-0-2.ec2.internal -> ip-10-10-0-36.ec2.internal DNS R  Error: 3(Name Error)
pool-100-8-18-194.nwrknj.fios.verizon.net -> ip-10-10-0-36.ec2.internal TCP D=22 S=40960 Ack=1440312748 Seq=1196264580 Len=0 Win=501 Options=<nop,nop,tstamp 388470452 569787>
pool-100-8-18-194.nwrknj.fios.verizon.net -> ip-10-10-0-36.ec2.internal TCP D=22 S=40960 Ack=1440312792 Seq=1196264580 Len=0 Win=501 Options=<nop,nop,tstamp 388470452 569787>
ip-10-10-0-36.ec2.internal -> ip-10-10-0-2.ec2.internal DNS C 51.90.83.99.in-addr.arpa. Internet PTR ?
ip-10-10-0-2.ec2.internal -> ip-10-10-0-36.ec2.internal DNS R  Error: 3(Name Error)
ip-10-10-0-36.ec2.internal -> pool-100-8-18-194.nwrknj.fios.verizon.net TCP D=40960 S=22 Push Ack=1196264580 Seq=1440312944 Len=76 Win=64436 Options=<nop,nop,tstamp 569798 388470452>
ip-10-10-0-36.ec2.internal -> pool-100-8-18-194.nwrknj.fios.verizon.net TCP D=40960 S=22 Push Ack=1196264580 Seq=1440313020 Len=36 Win=64436 Options=<nop,nop,tstamp 569798 388470452>
ip-10-10-0-36.ec2.internal -> pool-100-8-18-194.nwrknj.fios.verizon.net TCP D=40960 S=22 Push Ack=1196264580 Seq=1440313056 Len=44 Win=64436 Options=<nop,nop,tstamp 569798 388470452>
ip-10-10-0-36.ec2.internal -> 104.18.131.28 UDP D=33461 S=33901 LEN=20
 172.70.40.2 -> ip-10-10-0-36.ec2.internal ICMP Time exceeded (in transit)
ip-10-10-0-36.ec2.internal -> ip-10-10-0-2.ec2.internal DNS C 2.40.70.172.in-addr.arpa. Internet PTR ?
pool-100-8-18-194.nwrknj.fios.verizon.net -> ip-10-10-0-36.ec2.internal TCP D=22 S=40960 Ack=1440312868 Seq=1196264580 Len=0 Win=501 Options=<nop,nop,tstamp 388470456 569791>
ip-10-10-0-2.ec2.internal -> ip-10-10-0-36.ec2.internal DNS R  Error: 3(Name Error)
pool-100-8-18-194.nwrknj.fios.verizon.net -> ip-10-10-0-36.ec2.internal TCP D=22 S=40960 Ack=1440312944 Seq=1196264580 Len=0 Win=501 Options=<nop,nop,tstamp 388470459 569794>
ip-10-10-0-36.ec2.internal -> ip-10-10-0-2.ec2.internal DNS C 2.40.70.172.in-addr.arpa. Internet PTR ?
ip-10-10-0-2.ec2.internal -> ip-10-10-0-36.ec2.internal DNS R  Error: 3(Name Error)
ip-10-10-0-36.ec2.internal -> pool-100-8-18-194.nwrknj.fios.verizon.net TCP D=40960 S=22 Push Ack=1196264580 Seq=1440313100 Len=76 Win=64436 Options=<nop,nop,tstamp 569806 388470459>
ip-10-10-0-36.ec2.internal -> 104.18.131.28 UDP D=33462 S=33901 LEN=20
172.70.132.2 -> ip-10-10-0-36.ec2.internal ICMP Time exceeded (in transit)
ip-10-10-0-36.ec2.internal -> ip-10-10-0-2.ec2.internal DNS C 2.132.70.172.in-addr.arpa. Internet PTR ?
pool-100-8-18-194.nwrknj.fios.verizon.net -> ip-10-10-0-36.ec2.internal TCP D=22 S=40960 Ack=1440313100 Seq=1196264580 Len=0 Win=501 Options=<nop,nop,tstamp 388470463 569798>
ip-10-10-0-2.ec2.internal -> ip-10-10-0-36.ec2.internal DNS R  Error: 3(Name Error)
ip-10-10-0-36.ec2.internal -> ip-10-10-0-2.ec2.internal DNS C 2.132.70.172.in-addr.arpa. Internet PTR ?
ip-10-10-0-2.ec2.internal -> ip-10-10-0-36.ec2.internal DNS R  Error: 3(Name Error)
ip-10-10-0-36.ec2.internal -> 104.18.131.28 UDP D=33463 S=33901 LEN=20
ip-10-10-0-36.ec2.internal -> pool-100-8-18-194.nwrknj.fios.verizon.net TCP D=40960 S=22 Push Ack=1196264580 Seq=1440313176 Len=76 Win=64436 Options=<nop,nop,tstamp 569814 388470463>
173.245.63.243 -> ip-10-10-0-36.ec2.internal ICMP Time exceeded (in transit)
ip-10-10-0-36.ec2.internal -> ip-10-10-0-2.ec2.internal DNS C 243.63.245.173.in-addr.arpa. Internet PTR ?
pool-100-8-18-194.nwrknj.fios.verizon.net -> ip-10-10-0-36.ec2.internal TCP D=22 S=40960 Ack=1440313176 Seq=1196264580 Len=0 Win=501 Options=<nop,nop,tstamp 388470471 569806>
ip-10-10-0-2.ec2.internal -> ip-10-10-0-36.ec2.internal DNS R  Error: 3(Name Error)
ip-10-10-0-36.ec2.internal -> ip-10-10-0-2.ec2.internal DNS C 243.63.245.173.in-addr.arpa. Internet PTR ?
ip-10-10-0-2.ec2.internal -> ip-10-10-0-36.ec2.internal DNS R  Error: 3(Name Error)
ip-10-10-0-36.ec2.internal -> 104.18.131.28 UDP D=33464 S=33901 LEN=20
ip-10-10-0-36.ec2.internal -> pool-100-8-18-194.nwrknj.fios.verizon.net TCP D=40960 S=22 Push Ack=1196264580 Seq=1440313252 Len=84 Win=64436 Options=<nop,nop,tstamp 569824 388470471>
pool-100-8-18-194.nwrknj.fios.verizon.net -> ip-10-10-0-36.ec2.internal TCP D=22 S=40960 Ack=1440313252 Seq=1196264580 Len=0 Win=501 Options=<nop,nop,tstamp 388470479 569814>
172.70.132.4 -> ip-10-10-0-36.ec2.internal ICMP Time exceeded (in transit)
ip-10-10-0-36.ec2.internal -> ip-10-10-0-2.ec2.internal DNS C 4.132.70.172.in-addr.arpa. Internet PTR ?
ip-10-10-0-2.ec2.internal -> ip-10-10-0-36.ec2.internal DNS R  Error: 3(Name Error)
ip-10-10-0-36.ec2.internal -> ip-10-10-0-2.ec2.internal DNS C 4.132.70.172.in-addr.arpa. Internet PTR ?
ip-10-10-0-2.ec2.internal -> ip-10-10-0-36.ec2.internal DNS R  Error: 3(Name Error)
ip-10-10-0-36.ec2.internal -> 104.18.131.28 UDP D=33465 S=33901 LEN=20
ip-10-10-0-36.ec2.internal -> pool-100-8-18-194.nwrknj.fios.verizon.net TCP D=40960 S=22 Push Ack=1196264580 Seq=1440313336 Len=76 Win=64436 Options=<nop,nop,tstamp 569832 388470479>
 172.70.32.2 -> ip-10-10-0-36.ec2.internal ICMP Time exceeded (in transit)
ip-10-10-0-36.ec2.internal -> ip-10-10-0-2.ec2.internal DNS C 2.32.70.172.in-addr.arpa. Internet PTR ?
pool-100-8-18-194.nwrknj.fios.verizon.net -> ip-10-10-0-36.ec2.internal TCP D=22 S=40960 Ack=1440313336 Seq=1196264580 Len=0 Win=501 Options=<nop,nop,tstamp 388470489 569824>
ip-10-10-0-2.ec2.internal -> ip-10-10-0-36.ec2.internal DNS R  Error: 3(Name Error)
ip-10-10-0-36.ec2.internal -> ip-10-10-0-2.ec2.internal DNS C 2.32.70.172.in-addr.arpa. Internet PTR ?
ip-10-10-0-2.ec2.internal -> ip-10-10-0-36.ec2.internal DNS R  Error: 3(Name Error)
ip-10-10-0-36.ec2.internal -> 104.18.131.28 UDP D=33466 S=33901 LEN=20
ip-10-10-0-36.ec2.internal -> pool-100-8-18-194.nwrknj.fios.verizon.net TCP D=40960 S=22 Push Ack=1196264580 Seq=1440313412 Len=76 Win=64436 Options=<nop,nop,tstamp 569840 388470489>
104.18.131.28 -> ip-10-10-0-36.ec2.internal ICMP Destination unreachable (UDP port 33466 unreachable)
ip-10-10-0-36.ec2.internal -> ip-10-10-0-2.ec2.internal DNS C 28.131.18.104.in-addr.arpa. Internet PTR ?
ip-10-10-0-2.ec2.internal -> ip-10-10-0-36.ec2.internal DNS R  Error: 3(Name Error)
ip-10-10-0-36.ec2.internal -> ip-10-10-0-2.ec2.internal DNS C 28.131.18.104.in-addr.arpa. Internet PTR ?
ip-10-10-0-2.ec2.internal -> ip-10-10-0-36.ec2.internal DNS R  Error: 3(Name Error)
ip-10-10-0-36.ec2.internal -> pool-100-8-18-194.nwrknj.fios.verizon.net TCP D=40960 S=22 Push Ack=1196264580 Seq=1440313488 Len=76 Win=64436 Options=<nop,nop,tstamp 569843 388470489>
ip-10-10-0-36.ec2.internal -> pool-100-8-18-194.nwrknj.fios.verizon.net TCP D=40960 S=22 Push Ack=1196264580 Seq=1440313564 Len=60 Win=64436 Options=<nop,nop,tstamp 569844 388470489>
pool-100-8-18-194.nwrknj.fios.verizon.net -> ip-10-10-0-36.ec2.internal TCP D=22 S=40960 Ack=1440313412 Seq=1196264580 Len=0 Win=501 Options=<nop,nop,tstamp 388470497 569832>
pool-100-8-18-194.nwrknj.fios.verizon.net -> ip-10-10-0-36.ec2.internal TCP D=22 S=40960 Ack=1440313488 Seq=1196264580 Len=0 Win=501 Options=<nop,nop,tstamp 388470505 569840>
pool-100-8-18-194.nwrknj.fios.verizon.net -> ip-10-10-0-36.ec2.internal TCP D=22 S=40960 Ack=1440313564 Seq=1196264580 Len=0 Win=501 Options=<nop,nop,tstamp 388470508 569843>
pool-100-8-18-194.nwrknj.fios.verizon.net -> ip-10-10-0-36.ec2.internal TCP D=22 S=40960 Ack=1440313624 Seq=1196264580 Len=0 Win=501 Options=<nop,nop,tstamp 388470509 569844>